{
  "$schema": "https://json-schema.org/draft/2020-12/schema",
  "$id": "https://local-pii.dev/schemas/detection/detect-request/1.0.0",
  "title": "Inference detect request",
  "description": "Bounded contextual-inference request containing opaque chunks and no artifact metadata.",
  "schemaVersion": "1.0.0",
  "type": "object",
  "additionalProperties": false,
  "required": ["schemaVersion", "requestId", "chunks", "entityTypes", "minimumConfidence", "options"],
  "properties": {
    "schemaVersion": { "const": "1.0.0" },
    "requestId": { "type": "string", "format": "uuid" },
    "chunks": {
      "type": "array", "minItems": 1, "maxItems": 64,
      "items": {
        "type": "object", "additionalProperties": false, "required": ["id", "text", "absoluteStart"],
        "properties": {
          "id": { "type": "string", "minLength": 1, "maxLength": 100 },
          "text": { "type": "string", "minLength": 1, "maxLength": 20000 },
          "absoluteStart": { "type": "integer", "minimum": 0 },
          "language": { "type": "string", "pattern": "^[a-z]{2,3}(?:-[A-Z]{2})?$" }
        }
      }
    },
    "entityTypes": { "type": "array", "minItems": 1, "uniqueItems": true, "items": { "$ref": "https://local-pii.dev/schemas/common/entity-type/1.0.0" } },
    "minimumConfidence": { "type": "number", "minimum": 0, "maximum": 1 },
    "options": {
      "type": "object", "additionalProperties": false, "required": ["maxDetectionsPerChunk"],
      "properties": { "maxDetectionsPerChunk": { "type": "integer", "minimum": 1, "maximum": 1000 } }
    }
  },
  "examples": [{
    "schemaVersion": "1.0.0", "requestId": "d9b8a330-8d9a-4f6f-8f11-5b2f10e53967",
    "chunks": [{ "id": "chunk-0001", "text": "Synthetic Person", "absoluteStart": 0, "language": "en" }],
    "entityTypes": ["PERSON"], "minimumConfidence": 0.55, "options": { "maxDetectionsPerChunk": 200 }
  }]
}
